{
  "gegenereerdOp": "2026-09-28T07:45:44.464Z",
  "bronnen": [
    {
      "id": "coteq",
      "url": "https://d3a07q56iliqjn.cloudfront.net/web-uploads/Documenten/Open-data/CoteqNetbeheer_kleinverbruik_01012026.csv"
    },
    {
      "id": "liander",
      "url": "https://www.liander.nl/-/media/files/open-data/kleinverbruikdata/verbruiksdata-kv-2026.csv"
    },
    {
      "id": "rendo",
      "url": "https://www.rendonetwerken.nl/wp-content/uploads/2026/07/NV-RENDO_kleinverbruiksgegevens_01_07_2026.xlsx"
    },
    {
      "id": "stedin",
      "url": "https://www.stedin.net/-/media/project/online/files/zakelijk/open-data/stedin-kleinverbruikgegevens-2026.csv"
    },
    {
      "id": "westland",
      "url": "https://westlandinfra.nl/wp-content/uploads/2026/09/Westland_Infra_kleinverbruiksgegevens_01_01_2026.csv"
    }
  ],
  "standaard": "enexis",
  "postcodes4": {
    "liander": [
      "1011",
      "1012",
      "1013",
      "1014",
      "1015",
      "1016",
      "1017",
      "1018",
      "1019",
      "1021",
      "1022",
      "1023",
      "1024",
      "1025",
      "1026",
      "1027",
      "1028",
      "1029",
      "1030",
      "1031",
      "1032",
      "1033",
      "1034",
      "1035",
      "1036",
      "1037",
      "1041",
      "1042",
      "1043",
      "1044",
      "1045",
      "1046",
      "1047",
      "1048",
      "1049",
      "1050",
      "1051",
      "1052",
      "1053",
      "1054",
      "1055",
      "1056",
      "1057",
      "1058",
      "1059",
      "1060",
      "1061",
      "1062",
      "1063",
      "1064",
      "1065",
      "1066",
      "1067",
      "1068",
      "1069",
      "1071",
      "1072",
      "1073",
      "1074",
      "1075",
      "1076",
      "1077",
      "1078",
      "1079",
      "1081",
      "1082",
      "1083",
      "1086",
      "1087",
      "1088",
      "1089",
      "1090",
      "1091",
      "1092",
      "1093",
      "1094",
      "1095",
      "1096",
      "1097",
      "1098",
      "1099",
      "1100",
      "1101",
      "1102",
      "1103",
      "1104",
      "1105",
      "1106",
      "1107",
      "1108",
      "1109",
      "1110",
      "1111",
      "1112",
      "1113",
      "1114",
      "1115",
      "1116",
      "1117",
      "1118",
      "1119",
      "1120",
      "1121",
      "1122",
      "1123",
      "1124",
      "1125",
      "1126",
      "1127",
      "1128",
      "1129",
      "1130",
      "1131",
      "1132",
      "1135",
      "1141",
      "1145",
      "1146",
      "1147",
      "1148",
      "1149",
      "1150",
      "1151",
      "1153",
      "1154",
      "1155",
      "1156",
      "1161",
      "1165",
      "1166",
      "1167",
      "1168",
      "1169",
      "1170",
      "1171",
      "1175",
      "1176",
      "1177",
      "1178",
      "1179",
      "1180",
      "1181",
      "1182",
      "1183",
      "1184",
      "1185",
      "1186",
      "1187",
      "1188",
      "1189",
      "1191",
      "1211",
      "1212",
      "1213",
      "1214",
      "1215",
      "1216",
      "1217",
      "1218",
      "1219",
      "1220",
      "1221",
      "1222",
      "1223",
      "1241",
      "1243",
      "1244",
      "1251",
      "1252",
      "1261",
      "1262",
      "1271",
      "1272",
      "1273",
      "1274",
      "1275",
      "1276",
      "1277",
      "1300",
      "1309",
      "1310",
      "1311",
      "1312",
      "1313",
      "1314",
      "1315",
      "1316",
      "1317",
      "1318",
      "1319",
      "1321",
      "1322",
      "1323",
      "1324",
      "1325",
      "1326",
      "1327",
      "1328",
      "1329",
      "1330",
      "1331",
      "1332",
      "1333",
      "1334",
      "1335",
      "1336",
      "1338",
      "1339",
      "1341",
      "1342",
      "1343",
      "1344",
      "1345",
      "1346",
      "1347",
      "1348",
      "1349",
      "1351",
      "1352",
      "1353",
      "1354",
      "1355",
      "1356",
      "1357",
      "1358",
      "1359",
      "1360",
      "1361",
      "1362",
      "1363",
      "1381",
      "1382",
      "1383",
      "1384",
      "1394",
      "1398",
      "1399",
      "1400",
      "1401",
      "1402",
      "1403",
      "1404",
      "1405",
      "1406",
      "1407",
      "1408",
      "1409",
      "1410",
      "1411",
      "1412",
      "1421",
      "1422",
      "1423",
      "1424",
      "1431",
      "1432",
      "1433",
      "1435",
      "1436",
      "1437",
      "1438",
      "1439",
      "1440",
      "1441",
      "1442",
      "1443",
      "1444",
      "1445",
      "1446",
      "1447",
      "1448",
      "1451",
      "1452",
      "1454",
      "1456",
      "1457",
      "1458",
      "1461",
      "1462",
      "1463",
      "1464",
      "1471",
      "1472",
      "1473",
      "1474",
      "1475",
      "1476",
      "1477",
      "1481",
      "1482",
      "1483",
      "1484",
      "1485",
      "1486",
      "1487",
      "1488",
      "1489",
      "1501",
      "1502",
      "1503",
      "1504",
      "1505",
      "1506",
      "1507",
      "1508",
      "1509",
      "1511",
      "1521",
      "1525",
      "1531",
      "1534",
      "1535",
      "1536",
      "1541",
      "1544",
      "1546",
      "1551",
      "1561",
      "1562",
      "1566",
      "1567",
      "1601",
      "1602",
      "1603",
      "1604",
      "1605",
      "1606",
      "1607",
      "1608",
      "1609",
      "1611",
      "1613",
      "1614",
      "1615",
      "1616",
      "1617",
      "1618",
      "1619",
      "1621",
      "1622",
      "1623",
      "1624",
      "1625",
      "1627",
      "1628",
      "1631",
      "1632",
      "1633",
      "1634",
      "1636",
      "1637",
      "1638",
      "1639",
      "1640",
      "1641",
      "1642",
      "1643",
      "1645",
      "1646",
      "1647",
      "1648",
      "1652",
      "1654",
      "1655",
      "1656",
      "1657",
      "1658",
      "1659",
      "1660",
      "1661",
      "1662",
      "1663",
      "1671",
      "1674",
      "1676",
      "1678",
      "1679",
      "1681",
      "1682",
      "1683",
      "1684",
      "1685",
      "1686",
      "1687",
      "1688",
      "1689",
      "1690",
      "1691",
      "1692",
      "1693",
      "1695",
      "1696",
      "1697",
      "1698",
      "1699",
      "1700",
      "1701",
      "1702",
      "1703",
      "1704",
      "1705",
      "1706",
      "1707",
      "1708",
      "1709",
      "1710",
      "1711",
      "1713",
      "1714",
      "1715",
      "1716",
      "1718",
      "1719",
      "1720",
      "1721",
      "1722",
      "1723",
      "1724",
      "1731",
      "1732",
      "1733",
      "1734",
      "1735",
      "1736",
      "1737",
      "1738",
      "1741",
      "1742",
      "1744",
      "1746",
      "1747",
      "1749",
      "1751",
      "1752",
      "1753",
      "1754",
      "1755",
      "1756",
      "1757",
      "1759",
      "1761",
      "1764",
      "1765",
      "1766",
      "1767",
      "1768",
      "1769",
      "1771",
      "1772",
      "1773",
      "1774",
      "1775",
      "1777",
      "1778",
      "1779",
      "1781",
      "1782",
      "1783",
      "1784",
      "1785",
      "1786",
      "1787",
      "1788",
      "1789",
      "1791",
      "1792",
      "1793",
      "1794",
      "1795",
      "1796",
      "1797",
      "1811",
      "1812",
      "1813",
      "1814",
      "1815",
      "1816",
      "1817",
      "1818",
      "1819",
      "1820",
      "1821",
      "1822",
      "1823",
      "1824",
      "1825",
      "1826",
      "1827",
      "1828",
      "1829",
      "1831",
      "1832",
      "1834",
      "1841",
      "1842",
      "1843",
      "1844",
      "1846",
      "1847",
      "1848",
      "1849",
      "1850",
      "1851",
      "1852",
      "1853",
      "1861",
      "1862",
      "1865",
      "1871",
      "1873",
      "1901",
      "1902",
      "1906",
      "1911",
      "1921",
      "1931",
      "1932",
      "1933",
      "1934",
      "1935",
      "1936",
      "1937",
      "1938",
      "1939",
      "1940",
      "1941",
      "1942",
      "1943",
      "1944",
      "1945",
      "1946",
      "1947",
      "1948",
      "1949",
      "1951",
      "1961",
      "1962",
      "1963",
      "1964",
      "1965",
      "1966",
      "1967",
      "1968",
      "1969",
      "1971",
      "1972",
      "1973",
      "1974",
      "1975",
      "1976",
      "1977",
      "1978",
      "1979",
      "1980",
      "1981",
      "1982",
      "1983",
      "1984",
      "1985",
      "1991",
      "1992",
      "2011",
      "2012",
      "2013",
      "2014",
      "2015",
      "2019",
      "2020",
      "2021",
      "2022",
      "2023",
      "2024",
      "2025",
      "2026",
      "2031",
      "2032",
      "2033",
      "2034",
      "2035",
      "2036",
      "2037",
      "2041",
      "2042",
      "2051",
      "2061",
      "2063",
      "2064",
      "2065",
      "2071",
      "2082",
      "2111",
      "2114",
      "2116",
      "2117",
      "2118",
      "2119",
      "2120",
      "2121",
      "2131",
      "2132",
      "2133",
      "2134",
      "2135",
      "2136",
      "2141",
      "2142",
      "2143",
      "2144",
      "2151",
      "2152",
      "2153",
      "2154",
      "2155",
      "2156",
      "2157",
      "2158",
      "2159",
      "2161",
      "2162",
      "2163",
      "2165",
      "2171",
      "2172",
      "2181",
      "2182",
      "2191",
      "2201",
      "2202",
      "2203",
      "2204",
      "2211",
      "2212",
      "2215",
      "2216",
      "2217",
      "2218",
      "2219",
      "2220",
      "2221",
      "2222",
      "2223",
      "2224",
      "2225",
      "2226",
      "2227",
      "2228",
      "2229",
      "2230",
      "2231",